propId , label , description , aliases ,  type , count
P10,video,relevant video,media,commonsMedia,264
P109,signature,image of a person's signature,autograph,commonsMedia,3475
P117,chemical structure,representation of the structure for a chemical compound,crystallographic structure,commonsMedia,4224
P14,highway marker,graphic representing the highway,"motorway sign, shield, highway shield, road marker",commonsMedia,3930
P1442,grave picture,"picture of a person or animal's grave, gravestone or tomb","grave image, grave photo",commonsMedia,2633
P15,road map,map of the road,"route map, street map, road atlas, highway map",commonsMedia,3265
P154,logo image,"graphic mark or emblem commonly used by commercial enterprises, organizations and products",,commonsMedia,5279
P1543,monogram,image of a person's monogram,,commonsMedia,3
P158,seal image,image of subject's seal (emblem),emblem,commonsMedia,4174
P1621,detail map,a map containing details about the entire location,,commonsMedia,38
P1766,place name sign,image of road sign with place name on it,,commonsMedia,125
P18,image,"relevant illustration of the subject; if available, use more specific properties (sample: coat of arms image, locator map, flag image, signature image, logo image)","portrait, illustration, picture, drawing",commonsMedia,795805
P1801,commemorative plaque image,"image of plaque or inscription commemorating or mentioning the subject. For graves, use grave picture (P1442)",,commonsMedia,198
P181,range map image,range map of a taxon,"distribution map, spread map",commonsMedia,6074
P207,bathymetry image,"file with bathymetric chart, bathymetric map","bathymetric chart, bathymetric map, file bathymetry",commonsMedia,6
P242,locator map image,geographic map image which highlights the location of the subject,"map, locator map",commonsMedia,41541
P367,astronomic symbol image,image of the symbol that identify a planet or an asteroid of the solar system,,commonsMedia,30
P41,flag image,picture of the item's flag,"image flag, image of flag",commonsMedia,22146
P443,pronunciation audio,audio media file on Wikimedia Commons with pronunciation,,commonsMedia,467
P491,orbit diagram,image with the diagram of the orbit of an astronomic body,,commonsMedia,8
P51,audio,relevant sound,"song, recording, audio file, audio recording, sound recording",commonsMedia,592
P692,Gene Atlas Image,image showing the GeneAtlas expression pattern,,commonsMedia,1
P94,coat of arms image,image of the item's coat of arms,"symbol, heraldic representation, heraldic emblem, arms",commonsMedia,51120
P948,Wikivoyage banner,banner for the related Wikivoyage page,,commonsMedia,8588
P989,spoken text audio,audio file for the spoken work or Wikipedia article,,commonsMedia,330
P990,recording of the subject's spoken voice,audio file representing the speaking voice of a person; or of an  animated cartoon or other fictitious character,voice recording,commonsMedia,349
P996,scan file (Commons),file related to the content of the source/book/report on Wikimedia Commons,,commonsMedia,270
P1259,coordinates of the point of view,"point from which the scene depicted by the element is seen (element can be a photo, a painting, etc.)",,globe-coordinate,16
P1332,coordinate of northernmost point,northernmost point of a location. For an administrative entity this includes offshore islands,"most northerly, extreme point, farthest north",globe-coordinate,110
P1333,coordinate of southernmost point,southernmost point of a place. For administrative entities this includes offshore islands,"southerly, most south, farthest south, extreme point",globe-coordinate,109
P1334,coordinate of easternmost point,easternmost point of a location,"easterly, most eastern, farthest east, extreme point",globe-coordinate,108
P1335,coordinate of westernmost point,westernmost point of a location,"westerly point, extreme west, most western, extreme point",globe-coordinate,109
P625,coordinate location,geocoordinates of the subject,"coordinates, co-ordinate location, co-ordinates, coords, co-ords, location, geographic coordinate, gps coordinate, gps co-ordinate, gps coordinates, gps co-ordinates, gps location, geotag, wgs 84, wgs-84, wgs84, position, longitude, latitude, gps, coordinate location, geographical coordinates",globe-coordinate,2139981
P626,Sandbox-GeoCoordinateValue,"Sandbox property for value of type ""GeoCoordinateValue""",Sandbox-Coordinates,globe-coordinate,1
P1448,official name,official name of the subject in its official language(s),name,monolingualtext,1548
P1449,nickname,the nickname of an entity,,monolingualtext,433
P1451,motto text,short motivation sentence associated to item (e.g. at the bottom of its coat of arms),,monolingualtext,1214
P1476,title,the title of a work,original title,monolingualtext,15473
P1477,birth name,"full name of a person at birth, if different from their current, generally used name (samples: John Peter Doe for Joe Doe, Ann Smith for Ann Miller)","maiden name, born as, bn, bname, birth name (monolingual text), née",monolingualtext,1364
P1549,demonym,"the demonym for people or things associated with a given place. In English, this should start with a Capital letter. Singular masculine adjective form is preferred. Add a qualifier if another form is added.",,monolingualtext,360
P1559,name in native language,name of a person in their native language,,monolingualtext,388
P1635,religious name,name taken or used as a member of a religious community,,monolingualtext,47
P1638,working title,temporary name of a product or project used during its development,production title,monolingualtext,10
P1680,subtitle,"for works, when the title is followed by a subtitle",,monolingualtext,1227
P1683,quote,"quote supporting the statement claim (to be used in the ""sources"" field)",,monolingualtext,6
P1684,inscription,"inscriptions, markings and signatures on an object",,monolingualtext,84
P1705,native label,label for the items in their official language (Q23492) or their original language (P364),,monolingualtext,7924
P1813,short name,"the short name of a place, organisation, person etc.",,monolingualtext,3585
P1011,excluding,usually used as a qualifier,,null,0
P1016,asteroid taxonomy,type of asteroid classification,,null,0
P1032,Digital Rights Management system,technologies  to control the use of digital content and devices after sale,,null,0
P1039,type of kinship,"qualifier of ""relative (P1038)"" to indicate unusual family relationships (ancestor, son-in-law, adoptions, etc). Avoid using for relationships that can be derived from the family tree or have an explicit property (spouse, child, etc)",kinship,null,0
P1097,g-factor,characteristic property of any elementary particle (Landé factor),,null,0
P1106,sandbox-quantity,property to be used for testing the quantity datatype,,null,0
P1107,proportion,"to be used as a qualifier, value must be between 0 and 1",,null,0
P1111,votes received,number of votes for a candidate in an election,,null,0
P1126,isospin quantum number,characteristic property of any elementary particle,,null,0
P1127,isospin z-component,characteristic property of any elementary particle,,null,0
P1135,nomenclatural status,"the status of a scientific name, according to the relevant rules of nomenclature",,null,0
P1152,IPTC Media Topic,topic classification following the IPTC Media Topics vocabulary,,null,0
P1167,USB ID,vendor ID used in USB devices,,null,0
P1227,astronomical filter,passband used to isolate particular sections of the electromagnetic spectrum,"wavelength band, colour filter, filter",null,0
P1244,phone number (URL),number dialed into a telephone to communicate with a specific entity,,null,0
P1310,statement disputed by,entity that disputes a given statement,"disputed by, rejected by, opposed by",null,0
P1354,shown with features,features depicted in a work,,null,0
P1355,matches won/games won,number of matches or games won in a league or an event,"won, W",null,0
P1356,matches lost/games lost,number of matches or games lost in a league or an event,"lost, L",null,0
P1357,matches/games drawn/tied,number of matches or games drawn or tied in a league or an event,"D, T, drawn, tied",null,0
P1358,points for,number of points in a league table or decathlon. (Use P1351 for goals/points in a match),PTS,null,0
P1359,number of points/goals conceded,points conceded or goals against (use in league table items),"goals against, GA",null,0
P1390,match time of score (minutes),minutes into a game when a goal is scored,,null,0
P1437,plea,"whether a person pleaded guilty, not guilty, etc.",,null,0
P1443,score method,"qualifier of ""points/goal scored by (P1363)""",,null,0
P1450,Sandbox Monolingual text,sandbox for testing the monolingual text datatype,,null,0
P1480,sourcing circumstances,"qualifiers for claims: circa, misprint, presumably...",,null,0
P1608,Dialnet book,,,null,0
P1642,acquisition transaction,how the player was aquired; qualifier for P54 (member of sports team),,null,0
P1643,departure transaction,how the player was released or transferred from the roster; qualifier for P54 (member of sports team),release transaction,null,0
P1661,Alexa rank,The website's Alexa ranking with P585 as a qualifier for each value. The current value should be marked 'preferred'.,,null,0
P1665,Chess Games ID,Identifier on the website Chess Games (www.chessgames.com),,null,0
P1666,Chess Club ID,Identifier on the website Chess Club (www6.chessclub.com),,null,0
P1673,general formula,molecular formula of a class of compounds,,null,0
P1674,number confirmed,qualifier; number of occurrences classified as confirmed for reporting purposes,,null,0
P1675,number probable,qualifier for number of cases; number of occurrences classified as probable for reporting purposes,,null,0
P1676,number suspected,qualifier for number of cases; number of occurrences classified as suspected for reporting purposes,,null,0
P1686,awarded for work,qualifier of award received (P166) to specify the work that an award was given to the creator for,for their work on,null,0
P1688,AniDB identifier,ID on the site http://anidb.net,,null,0
P1689,central government debt as a percent of GDP,,,null,0
P1706,together with,qualifier to specify the person or group that this property is shared with,"shared with, award shared with",null,0
P1721,pinyin transliteration,hanyu pinyin transliteration of a pinyin text (usually to be used as a qualifier),,null,0
P1729,AllMusic album ID,ID of an album in AllMusic database,,null,0
P1730,AllMusic song ID,ID of a song in AllMusic database,,null,0
P1734,oath of office date,when person swore the oath of office,,null,0
P1775,follower of,for unknown artists who work in the manner of the named artist,,null,0
P1776,circle of,"for unknown artists who lived in the same time as the named author in a similar style, possibly a follower or someone who had contact with the named artist",,null,0
P1777,manner of,"for unknown artists who worked in a similar style as the named author, but not necessary from the same period",,null,0
P1778,forgery after,for an artwork trying to appear to be the work of the named author,,null,0
P1779,possible creator,for a creative work with consderable uncertainty about the author,,null,0
P1780,school of,"for a creative work with author with a style influenced by the known author or circle, active in the same period, but a student or follower",,null,0
P1828,IPI Code,"international unique identifier for composer, author and other relevant parties","Interested Parties Information Code, IPI",null,0
P1829,Roud Folk Song Index,"Id for a database of nearly 200,000 references to nearly 25,000 songs",,null,0
P1831,electorate,the number of registered voters for the place,,null,0
P1833,number of registered users/contributors,number of registered users on a website,,null,0
P1836,draft pick number,overall pick number with which a player is selected in a sports draft,,null,0
P368,Sandbox-CommonsMediaFile,"Sandbox property for value of type ""Commons Media File""",,null,0
P369,Sandbox-Item,"Sandbox property for value of type ""Item""",Wt. Intakes data experiment,null,0
P405,taxon author,the author(s) that (optionally) may be cited with the scientific name,"author citation, described by",null,0
P453,character role,specific role played or filled by subject (use only as qualifier of P161 or P725),role,null,0
P548,version type,type of version (qualifier for P348),,null,0
P554,website username,username on a website that the person or organization has an account on (only use as qualifier of P553),"username, handle, social media address, account name",null,0
P578,Sandbox-TimeValue,"Sandbox property for value of type ""TimeValue""","Sandbox-Time, Sandbox-Date",null,0
P654,direction relative to location,qualifier for geographical locations to express relative direction,DRTL,null,0
P659,GenLoc assembly,specify the genome assembly of the gene in UCSC Genome Informatics website,,null,0
P678,incertae sedis,qualifier for P171 (parent taxon) to mark which intermediate ranks are incertae sedis,,null,0
P697,ex taxon author,"person to whom to ascribe a taxon name, denoted by ""ex"" (via P405)",,null,0
P783,hymenium type,type of spore-bearing surface or that mushroom,,null,0
P792,chapter,title or number of the chapter where a claim is made,,null,0
P794,as,generic qualifier,has role,null,0
P820,arXiv classification,arXiv classification of pre-print articles,,null,0
P857,CNKI,identifier in the China National Knowledge Infrastructure database,,null,0
P875,UN code classification,UN code classification,,null,0
P893,Social Science Research Network ID,article/paper identifier at the SSRN,,null,0
P922,magnetic ordering,magnetic ordering of a substance,,null,0
P925,presynaptic connection,neuron connects on its presynaptic end to,,null,0
P926,postsynaptic connection,neuron connects on its postsynaptic end to,,null,0
P928,activating neurotransmitter,which neurotransmitter activates the neuron,Ligands,null,0
P929,color space,mathematical model describing the way colors can be represented as tuples of numbers,,null,0
P958,"section, verse, or paragraph","paragraph, column, or other kind of special indication to find information on a page or on a document (legal texts et al.)","title (of a section), entry, encyclopedia entry, dictionary entry",null,0
P967,guest of honor,"guest(s) of honor invited to an event, e.g. a convention",,null,0
P980,code for weekend and holiday homes (Sweden),a type of Statistics Sweden-code,,null,0
P999,ARICNS,ARICNS code,,null,0
P1081,Human Development Index,HDI value of a country,HDI,quantity,23
P1082,population,number of people inhabiting the place,,quantity,270331
P1083,seating capacity,"seating capacity of the venue, vehicle",number of seats,quantity,11455
P1086,atomic number,number of protons found in the nucleus of the atom,proton number,quantity,4651
P1087,ELO rating,"quantitative measure of one's game-playing ability, particularly in chess",,quantity,4
P1088,Mohs' hardness,,,quantity,48
P1090,redshift,the redshift measure of an astronomical object,,quantity,123
P1092,total produced,quantity of item produced,"Number produced, qty produced, qty built, qty made, number built, number made, total built, total made",quantity,2483
P1093,gross tonnage,unitless index related to a ship's overall internal volume,"ship gross tonnage, GT",quantity,14
P1096,orbital eccentricity,amount of the deviation of an orbit from a perfect circle,eccentricity,quantity,40
P1098,number of speakers,number of people who speak a language,,quantity,841
P1099,number of masts,number of masts a ship has,number of masts,quantity,12
P1100,number of cylinders,number of cylinders in a piston engine or compressor,,quantity,64
P1101,floors above ground,above ground floor count of a building (ground floor included),"number of floors, storeys, stories",quantity,185
P1102,flattening,measure of the compression of an ellipsoid of revolution,"ellipticity, oblateness",quantity,5
P1103,number of platforms,number of tracks serving a platform in a railway station,"platforms, railway station platforms, metro platforms",quantity,2388
P1104,number of pages,number of pages in an edition of a written work,"page count, pages",quantity,287
P1108,electronegativity,,,quantity,16
P1109,refractive index,refractive index of a substance with wavelength and temperature as qualifiers,,quantity,12
P1110,attendance,"number of people (spectators, ticket holders) at an event or exhibition",spectators,quantity,165
P1112,Pokédex number,a Pokémon identification number,Pokedex number,quantity,2642
P1113,series length,the number of items in a series,"episode count, number of episodes",quantity,335
P1114,quantity,number of instances of this subject,"qty, total number, number of instances, number",quantity,600
P1117,pKa,acid dissociation constant,,quantity,4
P1118,tennis singles ranking,ranking of player (use qualifiers P580 & P582 for timespan),singles ranking,quantity,244
P1119,tennis doubles ranking,ranking of player in doubles (use qualifiers P580 & P582 for timespan),,quantity,242
P1120,number of deaths,number of people who died as a result of an event or cause,"deaths, fatalities, qty deaths, qty fatalities, death toll, death count",quantity,376
P1121,oxidation state,,,quantity,157
P1122,spin quantum number,,,quantity,31
P1123,parity,property of elementary particle,,quantity,4
P1124,teu,"capacity measured in ""twenty-foot equivalent unit""",TEU,quantity,2
P1125,Gini coefficient,measure of statistical dispersion intended to represent the income distribution of a nation's residents,,quantity,16
P1128,employees,total number of employees of a company at a given point in time,number of employees,quantity,331
P1129,national team caps,,national team appearances,quantity,3
P1130,doubles titles,number of tournament victories in tennis doubles,,quantity,1
P1131,singles titles,number of tournament victories in tennis singles,,quantity,1
P1132,number of participants,"number of participants of an event, e.g. people or groups of people that take part in the event","participant count, participants, qty participants",quantity,213
P1139,floors below ground,the total number of below ground floors of the building,"underground floors, basement floors",quantity,23
P1141,number of processor cores,the number of independent actual processing units,,quantity,4
P1148,neutron number,number of neutrons of an isotope,,quantity,4505
P1164,cardinality of the group,number of elements in a finite group,"Group order, Group size",quantity,5
P1174,visitors per year ,number of people visiting a location each year,,quantity,1052
P1181,numeric value,numerical value of a number (e.g. 1) or a constant (e.g. pi),value,quantity,10120
P1193,prevalence,portion of a population with a given disease,,quantity,1
P1198,unemployment rate,portion of a workforce population that is not employed,,quantity,30
P1215,apparent magnitude,apparent magnitude of an astronomic object,,quantity,165
P1247,compression ratio,compression ratio of an engine,,quantity,7
P1279,inflation rate,percent change in CPI in one year,,quantity,2
P1295,emissivity ,ability of a substance to radiate thermal energy from its surface,,quantity,1
P1301,number of elevators,number of elevators in a building,"elevators, lifts",quantity,15
P1314,number of spans,number of spans a bridge has,,quantity,6
P1339,number of injured,number of people with non-fatal injuries in an event,"non-fatal injuries, injured, wounded, injury toll, injuries, number injured",quantity,71
P1342,number of seats,number of seats/members in an assembly (legislative house or similar),"number of members, seats",quantity,150
P1345,number of victims,number of victims of a serial killer,,quantity,2
P1350,number of matches played,matches or games a player officially appeared in,"matches played, caps, appearances, games played, games pitched, gp",quantity,5
P1351,number of points/goals scored,goals / points scored in a match used as qualifier to the participant. Use P1358 for league points.,"Goals for, GF, goals scored, points scored",quantity,4
P1352,ranking,person's ranking in a sport,,quantity,993
P1373,daily ridership,"number of people riding a transportation line or network, or using a station in a given day",,quantity,3
P1410,number of seats in legislature,number of seats a political party has in a given legislature,,quantity,4
P1418,orbits completed,number of orbits a spacecraft has done around a body,,quantity,1
P1436,collection or exhibition size,number of items in a collection or exhibition,,quantity,20
P1446,number of missing,"number of people missing after an event - qualify with ""point in time (P585)""","people missing, number of missing people, number missing, missing",quantity,5
P1457,absolute magnitude,absolute magnitude of an astronomic object,,quantity,4
P1458,color index,color index of an astronomical object,,quantity,2
P1470,maximum glide ratio ,maximum glide ratio of an aircraft,"best lift/drag ratio, best L/D-ratio",quantity,8
P1538,number of households,,,quantity,1
P1539,female population,,,quantity,41
P1540,male population,,,quantity,41
P1548,maximum Strahler number,"highest Strahler number of a stream, creek, or river",,quantity,61
P1561,number of survivors,number of people surviving an event,survivors,quantity,20
P1569,number of edges,number of edges of a shape,"edge, edges",quantity,12
P1570,number of vertices,number of vertices of a shape,,quantity,9
P1590,number of casualties,number of people dead or injured because of this event.  Used when precise data on number of deaths and number of injured is unavailable.,"number of deaths and injuries, casualities",quantity,5
P1603,number of cases,"the cumulative number of confirmed, probable and suspected occurrences",,quantity,6
P1641,port,default communication endpoint in TCP or UDP protocol,,quantity,74
P1658,number of faces,number of faces of a mathematical solid,,quantity,3
P1697,total valid votes,vote count for the elections (excluding invalid votes),,quantity,13
P1725,beats per minute,tempo of a musical work,,quantity,83
P1752,scale,"Proportional ratio of a linear dimension of a model, map, etc,  to the same feature of the original - 1:n. Use 1 for lifesize, positive numbers for smaller than lifesize, negative numbers for larger",scale ratio,quantity,2
P1003,NLR (Romania) identifier,authority control identifier used at the National Library of Romania,,string,83
P1004,MusicBrainz place ID,place identifier in the MusicBrainz open music encyclopedia,"MBID, place MBID, MB place id, place ID",string,2468
P1005,PTBNP identifier,identifier for the Portuguese National Library,,string,4664
P1006,NTA identifier (Netherlands),National Thesaurus for Author names (Dutch author-name thesaurus),"Nationale Thesaurus voor Auteurs, NTA",string,129367
P1007,Lattes Platform number,number for the Lattes Platform entry on the person or group. Relationship between entry and subject must be supported by a source,,string,7
P1010,Iran statistics ID,ID given to places on Iran,,string,8
P1014,AAT identifier,ID in the Art & Architecture Thesaurus by the Getty Research Institute,"AAT ID, Art & Architecture Thesaurus ID",string,991
P1015,BIBSYS identifier,ID for Norwegian information systems BIBSYS,,string,6662
P1017,BAV (Vatican Library) identifier,authority control identifier used at the Vatican Library,BAV,string,8016
P1021,KldB-2010 occupation code,German classification of occupations 2010,,string,1
P1022,CNO-11 occupation code, Spanish classification of occupations CNO-11 maintained by the Spanish INE (Instituto Nacional de Estadística),,string,2
P1023,SBC-2010 occupation code," Dutch classification of occupations SBC maintained by the Dutch CBS (Centraal Bureau voor de Statistiek), 2010 version",,string,3
P1024,SBFI occupation code,Swiss classification of occupations SBFI/SEFRI maintained by the Swiss SBFI/SEFRI,,string,2
P1025,SUDOC editions,item number in the French union catalog (see also P269),,string,79
P1030,light characteristic of a lighthouse,description of a navigational light sequence or colour displayed on a nautical chart,,string,53
P1031,legal citation of this text,legal citation of legislation or a court decision,"case citation, neutral citation, parallel citation, statute citation, regulation citation, citation",string,295
P1036,Dewey Decimal Classification,"use with qualifier ""edition (p747)"" with item value ""DDC 23"" or create new item to represent the corresponding DDC edition","DDC, Q48460",string,13775
P1042,ZDB identifier,identifier for serials,,string,656
P1043,IDEO Job ID,occupation ID on IDEO,,string,10
P1044,SWB editions,union catalog of the South-West German Library Network (SWB),,string,138
P1045,Sycomore ID,"ID of a person in the Sycomore database, by the French National Assembly",,string,9354
P1047,Catholic Hierarchy ID,ID of the person on catholic-hierarchy.org,Catholic Hierarchy bishop identifier,string,4031
P1048,NCL identifier,authority control number of the National Central Library in Taiwan,,string,10
P1051,PSH ID,Identifier in the authority database of the Czech Technical Library,"PSH, Czech Technical Library ID, PSH identifier",string,819
P1052,Portuguese Job Code CPP-2010,,,string,4
P1053,ResearcherID,an identifying system for scientific authors,RID,string,42
P1054,NDL editions,ID in the National Diet Library (see also P349),NDL catalog ID,string,13
P1055,NLM ID,identifier in the catalog of the National Library of Medicine,,string,6
P1058,ERA Journal ID,identifier for academic journals,,string,22502
P1059,CVR,The Central Business Register identifier. Number for the official database of Danish companies/organizations,Central Business Register,string,98
P1067,Thailand central administrative unit code,identifier for each of the Thai central administrative units,TIS 1099,string,6967
P1069,Danemark Job Code (DISCO-08),Danemark Job Code DISCO-08 maintained by the DST and derived from ISCO,,string,4
P1070,PlantList-ID,ID in the database of 'The Plant List',,string,331190
