propId , label , description , aliases ,  type , count
P613,OS grid reference,grid location reference from the Ordnance Survey National Grid reference system used in Great Britain,,string,213
P617,yard number,number of the ship assigned by its builder (shipyard),,string,30
P627,IUCN-ID,source for IUCN conservation status (P141),,string,1
P628,E number,number for food additives that are legal in the European Union,,string,511
P630,Paris city digital code,digital identifier for streets in Paris,,string,5474
P632,cultural properties of Belarus reference number,,,string,56
P633,Répertoire du patrimoine culturel du Québec identifier,Identification number in the directory of the cultural heritage of Quebec,,string,330
P635,ISTAT ID,identifier for municipalities in Italy,,string,8110
P637,RefSeq Protein ID,protein Identifier,,string,4091
P638,PDB ID,gene entry for 3D structural data as per the PDB(Protein Data Bank) database,,string,8851
P639,RefSeq RNA ID,RNA Identifier,,string,186706
P640,Léonore ID,ID of a person in the Léonore database,Léonore identifier,string,2559
P644,genomic start,genomic starting coordinate of the biological sequence (e.g. a gene),"Genloc Start, genomic from, Genloc From, from, start coordinate",string,7331
P645,genomic end,genomic ending coordinate of the biological sequence (e.g. a gene),"Genloc End, genomic stop, Genloc Stop, stop, stop coordinate",string,7328
P646,Freebase identifier,ID specifying an equivalent page in the Freebase open knowledge graph,"Freebase ID, mid",string,1154072
P648,Open Library identifier,"numeric identifier for works, editions and authors","Open Library ID, OLID",string,120
P649,NRHP reference number,National Register of Historic Places reference number assigned by the National Park Service of the USA,"National Register of Historic Places, National Register of Historic Places ID, NRHP, NRHP ID, National Register of Historic Places number, NRHP number",string,37903
P650,RKDartists,ID in the RKDartists database (Rijksbureau voor Kunsthistorische Documentatie),,string,27591
P651,Biografisch Portaal number,ID at Biografisch Portaal van Nederland,BPN,string,7552
P652,UNII,Unique Ingredient Identifier,UNII,string,10846
P653,PubMed Health,ID published by the PubMed Health website,"PMH-ID, PMHIC",string,7
P656,RefSeq,qualifier to specify Reference Sequence identifier for the Protein and RNA (either p637 or p639),,string,14
P657,RTECS number,chemical identifier from the Registry of Toxic Effects of Chemical Substances,,string,1229
P661,ChemSpider ID,"free chemical database, owned by the Royal Society of Chemistry",,string,10356
P662,PubChem ID (CID),database of chemical molecules and their activities in biological assays (only CID number),,string,15236
P663,DSM IV,classification found in the Diagnostic and Statistical Manual of Mental Disorders,,string,3
P665,KEGG ID,"databases dealing with genomes, enzymatic pathways, and biological chemicals",,string,3549
P667,ICPC 2 ID,classification method for primary care encounters,"ICPC 2, ICPC2",string,4
P668,GeneReviews ID,collection of peer-reviewed articles that describe specific gene-releated diseases,,string,157
P670,street number,"number in the street address. To be used as a qualifier of Property:P669 ""street""",,string,7
P671,Mouse Genome Informatics ID,ID of a gene in the Mouse Genome Informatics database,"MGI, MGI ID, Mouse Genome Informatics",string,6
P672,MeSH Code,Medical Subject Headings (MeSH) codes are an index and thesaurus for the life sciences (≠ MeSH ID),,string,56
P673,eMedicine,online clinical medical knowledge base,,string,2333
P675,Google Books identifier,this identifier gives access to the books that Google has scanned,,string,114
P677,ÚSOP code,"identifier in drusop.nature.cz, a national database of protected areas and trees",,string,2611
P679,ZVG number,identifier of GESTIS database,,string,1
P683,ChEBI ID,database and ontology of molecular entities focused on 'small' chemical compounds,Chemical Entities of Biological Interest,string,3616
P685,NCBI Taxonomy ID,ID of a taxon in the Taxonomy Database by the National Center for Biotechnology Information,ncbi,string,253787
P686,Gene Ontology ID,ID in the Gene Ontology,,string,7366
P687,BHL Page Id,identifier in the Biodiversity Heritage Library (BHL),,string,192
P691,NKC identifier,ID in National authority file of the Czech Republic (National Library of CR),"Czech national authority file, NK ČR",string,22152
P695,UN number,"four-digit numbers that identify hazardous substances, and articles (such as explosives, flammable liquids, toxic substances, etc.) in the framework of international transport",,string,417
P696,Neurolex ID,ID in the Neurolex database,,string,13
P698,PubMed ID,ID for journal articles/abstracts in PubMed,PMID,string,96
P699,Disease Ontology ID,ID in the Disease Ontology database,,string,8869
P700,Kemler ID,code describing the hazards of a chemical in transport,,string,2
P701,Dodis,"identifier in the dodis database (Diplomatic Documents of Switzerland 1945-1969), see Q661051",Dodis ID,string,23
P704,Ensembl Transcript ID,transcript ID issued by Ensembl database,,string,227468
P705,Ensembl Protein ID,protein ID issued by Ensembl database,,string,7899
P709,Historic Scotland ID,Building ID for items in the Historic Scotland database,,string,41431
P711,Strunz 8th edition (series ID),"mineral classification 8th edition, series identifier, silicate classification modified by Athena",,string,3101
P712,Nickel-Strunz 9th edition (updated 2009),"mineral classification Nickel-Strunz version 9 (updated 2009), a PDF format file",,string,3266
P713,Nickel-Strunz 10th (pending) edition,mineral classification Nickel-Strunz version 10 (mindat.org),,string,3665
P714,Dana 8th edition,mineral classification Dana 8th edition,,string,1288
P715,Drugbank ID,bioinformatics and cheminformatics database from the University of Alberta,,string,2069
P716,JPL Small-Body Database identifier,astronomy database of small Solar System bodies,,string,15366
P717,Minor Planet Center observatory code,observational data for minor planets (asteroids) and comets,IAU code,string,437
P718,Canmore ID,identifier in  the Royal Commission on the Ancient and Historical Monuments of Scotland's Canmore database,RCAHMS,string,11
P721,OKATO identifier,identifier for every administrative unit in Russia,,string,72016
P722,UIC station code,"UIC ids are used by railway operators to refer to railway stations in Europe, CIS-countries, China, Mongolia, north Africa and Middle-east.",,string,4799
P723,DBNL ID,reference to the DBNL-website for Dutch language authors,"Digitale Bibliotheek voor de Nederlandse Letteren identifier, Digital Library for Dutch Literature identifier",string,7055
P724,Internet Archive ID,globally unique ID of a given item on archive.org,,string,194
P727,Europeana ID,"interface to millions of books, paintings, films, museum objects and archival records that have been digitised throughout Europe",,string,75421
P728,GHS hazard statement,globally harmonized system of assessment and labeling of chemicals,"GHS, GHS EU",string,132
P731,Litholex ID,Lithostratigraphic database of Germany maintained by the BGR,,string,18
P732,BGS Lexicon ID,ID for stratigraphic unit given by the British Geological Survey,,string,39
P733,DINOloket ,database of geologic units in the Netherlands (Data Informatie Nederlandse Ondergrond),,string,7
P742,pseudonym,alias used by someone or by which this person is universally known,"nom-de-plume, alias, pen name, stage name",string,1217
P745,Low German Bibliography and Biography ID,,PBB ID,string,26
P757,World Heritage Site id,"site reference number as assigned by UNESCO. Use on one item per site, link parts with property ""has part"" (P527)",UNESCO WHS,string,1180
P758,Kulturminne identifier,Norwegian heritage property identification number of Riksantikvaren (the Directorate for Cultural Heritage),Lokalitets ID,string,2118
P759,Alberta Register of Historic Places identifier,identification number of historic resources in the Alberta Register of Historic Places,,string,50
P760,DPLA ID,"books, paintings, films, museum objects and archival records that have been digitised throughout United States",,string,3
P761,VISS ID,identifier in the Swedish National Water Information Database (VISS),,string,236
P762,Czech cultural heritage ID ,identifier for cultural heritage properties in the Czech Republic,,string,180
P763,PEI Register of Historic Places identifier,"identifier of a historic place in Prince Edward Island, Canada",,string,18
P764,OKTMO identifier,identifier in Classification on Objects territory of municipal formations (Russia),,string,63131
P771,Swiss municipality code,id for municipalities in Switzerland,BFS number,string,2604
P772,INE municipality code,"identifier for Spanish municipalities, by the Spanish Statistical Office (INE)",,string,8192
P773,ISO 3166-3,codes for country names which have been deleted from ISO 3166-1 since its first publication in 1974,Code for formerly used names of countries,string,6
P774,FIPS 55-3 (locations in the US),identifier for places in the United States per former Federal Information Processing Standard FIPS 55-3,"Federal Information Processing Standard 55-3, FIPS 55-3, fips code for US locations",string,342
P775,Swedish urban area code,urban area code in Sweden,"Tätortskod, Tatortskod",string,2229
P776,Swedish minor urban area code,urban area code for Sweden,"Småortskod, Smaortskod",string,154
P777,Swedish civil parish code/ATA code,civil parish code for Sweden,Sockenkod,string,3
P778,Swedish code for parishes in the Church,Church of Sweden parish code,"Församlingskod, code for parishes in the Church of Sweden",string,6
P779,Swedish Pastoratskod,Pastoral district code for the Church of Sweden,"Pastoratskod, Church of Sweden Pastoratskod",string,5
P781,Sikart,"identifier in SIKART, a biographical dictionary and a database on visual art in Switzerland and Liechtenstein",,string,1537
P782,LAU,"local administrative unit, renamed from NUTS 4 and NUTS 5",,string,6628
P791,ISIL ID,International Standard Identifier for Libraries and Related Organizations,ISIL,string,379
P798,military designation,officially assigned designation for a vehicle in military service,"Tri-Service aerospace vehicle designation, USDOD aircraft designation, 1962 US military aerospace vehicle designation, mdsd, mission design series designation, MAD",string,915
P799,Air Ministry specification,aircraft specification issued by the United Kingdom Air Ministry,"specification, UK Air Ministry specification",string,9
P804,GNIS Antarctica ID,"identification code for geographic objects in Antarctica, used in the US Geological Survey's Geographic Names Information System. For U.S. IDs, use Property:P590",USGS GNIS Antarctica ID,string,120
P806,Italian cadastre code,identifier for Italian comunes in the cadastre,codice catastale,string,8094
P808,code Bien de Interés Cultural,Spanish heritage register. Format is RI-XX-nnnnnnn-n?n?n?nnnn,BIC,string,62
P809,WDPA id,identifier in World Database on Protected Areas,World Database on Protected Areas indentifier,string,2441
P815,ITIS TSN,unique Taxonomic Serial Number defined by Integrated Taxonomic Information System,itis,string,334068
P818,arXiv ID,identifier of arXiv pre-print archive,,string,4
P819,ADS bibcode,bibcode in the Astrophysics Data System,,string,6
P821,CGNDB Unique Identifier,identifier the geographical feature of the Geographical Names Board of Canada,,string,115
P824,Meteoritical Bulletin Database ID,ID for meteorites in the database of the Meteoritical Society,,string,27
P827,BBC program identifier,identifier for the corresponding item on the BBC website and internal systems,"pid, BBC pid, PIPs identifier",string,93
P829,OEIS ID,ID on the On-Line Encyclopedia of Integer Sequences,,string,131
P830,Encyclopedia of Life ID,eol.org item reference number,eol,string,156271
P835,author citation (zoology),citation of those involved in the publication of a zoological name,author abbreviation,string,75
P836,GSS code (2011),"UK Government Statistical Service code, a fixed length code of nine characters (new codes introduced in 2011)",ONS GSS code (2011),string,36
P838,BioLib ID,ID in the biological encyclopedia BioLib,,string,138
P839,IMSLP ID,title of page on the International Music Score Library Project,IMSLP,string,222
P842,Fossilworks ID,"identifier for fossil animals, plants, and microorganisms","paleodb, fossilworks",string,8390
P843,SIRUTA code,National Institute of Statistics code for an area of Romania,,string,16937
P844,UBIGEO code,coding system for geographical locations in Peru used by the National Statistics Institute,,string,14
P845,Saskatchewan Register of Heritage Property identifier,identifier of the Saskatchewan Register of Heritage Property,,string,34
P846,Global Biodiversity Information Facility ID,,GBIF ID,string,2225
P847,United States Navy aircraft designation,aircraft identifier,USN aircraft designation,string,42
P849,Japanese military aircraft designation,aircraft designation per the Japanese military,,string,2
P850,World Register of Marine Species identifier,,"WoRMS-ID, worms, AphiaID",string,211805
P858,ESPN SCRUM ID,"identifier for any international rugby union player, from the site www.espnscrum.com",,string,3646
P860,e-archiv.li ID,"identifier in e-archiv.li, a directory of sources of Landesarchiv Liechtenstein",,string,2
P861,premiershiprugby.com ID,unique identifier for each rugby union player who plays - or played - the English Premiership,,string,343
P862,Operational Requirement of the UK Air Ministry,specification for future military aircraft by the UK Air Ministry,"OR, operational requirement",string,4
P863,InPhO identifier ,link to the Indiana Philosophy Ontology project,Indiana Philosophy Ontology identifier,string,2
P864,ACM Digital Library author identifier,Association for Computing Machinery Digital Library (ACM DL) author identifier,,string,1
P865,BMLO,Bayerisches Musiker-Lexikon Online (Q47191),,string,5373
P866,Perlentaucher ID,identifier in Perlentaucher (Q2071388),,string,8963
P867,ROME Occupation Code (v3),"ROME Code for a given occupation in France (V3, 1 letter, 4 digits)","ROME Code, code rome",string,227
P874,UN class,UN hazard classification code,,string,2
P876,UN packaging group,packaging code according to UN transportation rules,,string,2
P877,NFPA Other,NFPA Other,NFPA Special,string,1
P879,pennant number,"the number or designation associated with individual warships, often painted on the hull.","pendant number, hull number",string,607
P882,FIPS 6-4 (US counties),identifier for US counties per former Federal Information Processing Standard FIPS 6-4. Use two-digit state code followed by three digit county code,"FIPS 6-4, FIPS US counties, INCITS 31-2009",string,3296
P883,FIPS 5-2 (code for US states),identifier for US states and other associated areas (numeric or alpha) per Federal Information Processing Standard FIPS 5-2,"FIPS 5-2, FIPS code for US states",string,129
P884,State Water Register Code (Russia),Body water identification code,,string,22334
P886,LIR,"identifier in the Lexicon istoric retic (LIR), Romansh variant of Historical Dictionary of Switzerland",,string,22
P888,JSTOR article ID,JSTOR stable periodical article identifier,,string,3
P889,Mathematical Reviews identifier,"Mathematical Reviews is a journal and online database published by the American Mathematical Society (AMS) that contains brief synopses (and occasionally evaluations) of many articles in mathematics, statistics and theoretical computer science.",,string,1
P892,Request for Comments identifier,"Request for Comments is a publication of IETF and the Internet Society (without ""RFC"" prefix)","RFC, RfC",string,43
P894,Zentralblatt MATH,identifier in the zbMath database,,string,9
P897,United States Army and Air Force aircraft designation,aircraft identifier for US Army and Air Force aircraft until 1962,"US Army aircraft designation, USAF aircraft designation",string,37
P898,IPA,spelling in the International Phonetic Alphabet,pronunciation (IPA),string,179
P901,FIPS 10-4 (countries and regions),identifier for countries and regions per former Federal Information Processing Standard FIPS 10-4,fips country codes,string,4201
P902,HDS,"identifier in HDS/HLS/DHS/DSS: Historical Dictionary of Switzerland (Q642074), a national encyclopedia","HLS, DHS, DSS",string,9422
P905,PORT identifier,the PORT-network identifier of film or television program,,string,2886
P906,SELIBR,Libris library catalog ID number,LIBRIS,string,6744
P907,allgame ID,allgame video game database ID number,AMG game ID,string,7
P909,Nova Scotia Register of Historic Places identifier,The unique identifier of Nova Scotia Register of Historic Places,,string,32
P911,South African municipality code,ID for municipalities in South Africa,,string,278
P917,GRAU index,index of Russian (and Soviet) weapons and rockets,,string,111
P918,NOC Occupation Code,NOC/CNP Code for a given occupation in Canada and Québec,"Code CNP, NOC Code",string,2
P919,SOC Occupation Code (2010),Standard Occupational Classification code for US jobs (2010 version),,string,2
P920,Spanish subject headings for public libraries,"subject headings for public libraries maintained by the Spanish Ministry of Education, Culture and Sport. Terms are linked (in different numbers) to LCSH, GND, RAMEAU, LEMAC (Subject Headings in Catalan).",,string,2
P932,PMCID,identifier issued by PubMed Central,"PubMed Central ID, PMC ID",string,3
P933,heritagefoundation.ca ID,unique identifier of Heritage Foundation of Newfoundland and Labrador,,string,18
P935,Commons gallery,name of the Wikimedia Commons gallery page(s) related to this item (is suitable to allow multiple link to more gallery pages),,string,8587
P938,FishBase species identifier,,fishbase,string,104
P939,KSH code,identifier for every municipality (town and commune) in Hungary issued by the Hungarian Central Statistical Office,,string,3176
P940,GHS precautionary statements,code referring to a phrase giving advice about the correct handling of chemical substances and mixtures,,string,167
P946,ISIN,International Securities Identification Number,,string,157
P947,RSL identifier,identifier of the Russian State Library,,string,239
P949,NLI (Israel) identifier,authority control identifier used at the National Library of Israel,NLI,string,6522
P950,BNE identifier,authority file of the Biblioteca Nacional de España,,string,4672
P951,NSZL identifier,authority file of the National Széchényi Library,,string,181
P952,ISCO occupation code,International Standard Classification of Occupations code,CITP,string,157
P954,IBNR identifier,international station number for railway stations (Internationale Bahnhofsnummer),,string,328
P957,ISBN-10,"International Standard Book Number, ten digit variant","isbn-10, International Standard Book Number",string,11084
P959,MSW species identifier,Mammal Species of the World: a database that claims to provide an authoritative and comprehensive list of names of mammals (but the ICZN does not agree),,string,5256
P960,Tropicos taxon name identifier,identification number in Tropicos database,Tropicos ID,string,319848
P961,IPNI taxon name identifier,International Plant Names Index is a database that provides an authoritative and comprehensive list of names of plants. It is different from Property:P586 which is for authors not taxon. But it is related to Property:P428.,,string,276572
P962,MycoBank taxon name identifier,MycoBank is a database that provides an authoritative and comprehensive list of names of fungi.,,string,60
P964,Austrian municipality key,identifier for municipalities in Austria,,string,2389
P965,burial plot reference,"string of references which identify a specific plot in a burial area, e.g. cemetery",,string,39
P966,MusicBrainz label ID,label identifier in the MusicBrainz open music encyclopedia,"Label MBID, record label, MusicBrainz Record Label ID, MB label, Label ID, MBID",string,4019
P969,located at street address,street address that the subject is located at,"address, street address",string,287547
P981,BAG-code for Dutch towns,"BAG (woonplaatscode) for Dutch towns, see Q1852859",,string,2505
P982,MusicBrainz area ID,area identifier per the MusicBrainz open music encyclopedia,"MBID, area MBID",string,11245
P984,IOC country code,three-letter abbreviation country code by the International Olympic Committee,,string,234
P988,Philippine Standard Geographic Code,systematic classification and coding of geographic areas of the Philippines.,PSGC,string,164
P993,NFPA Health,,,string,8
P994,NFPA Fire,,,string,8
P995,NFPA Reactivity,NFPA code for chemical or physical reactivity,,string,8
P998,dmoz,Open Directory Project,"Open Directory Project, ODP, Netscape Open Directory, NewHoo, GNUHoo, directory.mozilla, Mozilla Directory",string,6740
P1191,first performance,date a work was first performed,"air date, premiere, broadcast date, time of first performance",time,196
P1249,time of earliest written record,first time a subject was mentioned in writing,"date of first written record, first historic record, earliest record, first recorded in",time,183
P1317,floruit,"When the person was known to be active or alive, when birth or death not documented (contrast with P585 and P746). Enter two values if the subject has produced works during a range of years","fl., known alive in, active, fl, years active, flourished",time,477
P1319,earliest date,earliest date at which an event could have happened,"after this date, later than",time,2
P1326,latest date,latest possible time that something could have occurred,"before this date, earlier than",time,3
P1619,time of official opening,"date or point in time an event, museum, theater etc. officially opened","date of official opening, time of official opening",time,5711
P1636,date of baptism in early childhood,"date when a person was baptized. For times when only baptism records were available, this can be a good substitute for date of birth.","baptism date, date of baptism, date baptism, time of baptism",time,192
P569,date of birth,date on which the subject was born,"born on, birth date, birthday, birthdate, birth year, year of birth, birthyear, DOB",time,1832898
P570,date of death,date on which the subject died,"date of the end, death, death date, died on, DOD, year of death, dead, deathdate",time,909740
P571,inception,date or point in time when the organization/object was founded/created,"date founded, date created, incorporated, foundation, founded, created, date of foundation, date of creation, established, establishment date, foundation date, creation date, incorporation date, date incorporated, date of incorporation, date of establishment, founding date, date of founding, date formed, formation date, formed on date, founded on date, incorporated on date, established on date, created on date, commencement date, date commenced, commenced on date, date of commencement, foundation/creation date, time of foundation or creation, date of foundation or creation, written, written on date",time,80610
P574,date of taxon name publication,date of publication of the scientific name of a taxon,"taxon date, taxon year, described in, year of scientific description, date of scientific description",time,25
P575,time of discovery,date or point in time when the item was discovered,"date discovered, discovery date, date of discovery",time,50990
P576,dissolved or abolished,date or point in time on which the organisation was dissolved,"defunct date, dissolution date, dissolved on date, wound up on date, date of dissolution, date dissolved, date disbanded, date disestablished, disestablished, abolished, abolishment date, disbanded on, time dissolved, time of dissolution, time abolished, time of abolishment",time,6891
P577,publication,date or point in time when this work was first published (don't replace old values),"publication date, release date, premiere date, date published, date released, published, dop, year of publication, initial release, date of release, date of publication, released, time of publication",time,182946
P580,start time,"indicates the time an item begins to exist or a statement starts being valid, usually used as a qualifier","from, starting, beginning, began, from time, since, start time, from date, start date, building date, starttime",time,6896
P582,end time,indicates the time an item ceases to exist or a statement stops being valid,"to, to time, left office, until, ending, divorced, enddate, end time, closed, end date, fall date",time,6609
P585,point in time,"time and date something took place, existed or a statement was true","date, as of, time of event, at time, when, year, time, When?",time,15251
P606,first flight,date or point in time on which aircraft first flew,"maiden flight, 1st flight, time of first flight",time,301
P619,time of spacecraft launch,date and time of spacecraft launch in UTC,"date of spacecraft launch, spacecraft launch date",time,5468
P620,time of spacecraft landing,date and time of spacecraft landing in UTC,"spacecraft landing time, spacecraft landing date",time,20
P621,time of spacecraft orbit decay,date and time of spacecraft orbit decay in UTC,"decay date, time of spacecraft decay",time,1
P622,spacecraft docking/undocking,,"docking date, undocking date, time of spacecraft docking/undocking",time,1
P729,service entry,date or point in time on which a piece or class of equipment entered operational service,"introduction, entered service, date of service entry, time of service entry, launched",time,3802
P730,service retirement,date or point in time on which a piece or class of equipment was retired from operational service,"retirement, retired, date of service retirement, time of service retirement",time,1491
P746,date of disappearance,date or point of time a missing person was seen or otherwise known to be alive for the last time,"disappeared, last known alive before disappearance, time of disappearance",time,31
